name,downloads,description,created_at,updated_at,documentation,homepage,repository,id
image,8835237,Imaging library written in Rust. Provides basic filters and decoders for the most common image fo...,2014-11-20 20:03:29.764042,2022-07-19 01:40:31.901228,https://docs.rs/image,https://github.com/image-rs/image,https://github.com/image-rs/image,136
config,8771267,Layered configuration system for Rust applications.,2015-04-16 18:35:56.393987,2022-08-02 14:48:23.580993,,https://github.com/mehcode/config-rs,https://github.com/mehcode/config-rs,1879
tokio-fs,8754700,Filesystem API for Tokio. ,2018-02-01 17:42:57.822969,2020-02-05 00:25:24.864276,https://docs.rs/tokio-fs/0.1.7/tokio_fs,https://tokio.rs,https://github.com/tokio-rs/tokio,49183
build_const,8715982,library for creating importable constants from build.rs or a script,2017-05-29 21:48:33.285186,2021-04-20 02:31:13.785806,https://docs.rs/build_const,,https://github.com/vitiral/build_const,16827
tokio-uds,8711371,Unix Domain sockets for Tokio ,2016-09-10 01:04:19.834404,2020-07-01 20:40:33.134556,https://docs.rs/tokio-uds/0.2.7/tokio_uds/,https://github.com/tokio-rs/tokio,https://github.com/tokio-rs/tokio,6303
blake2b_simd,8701872,a pure Rust BLAKE2b implementation with dynamic SIMD,2018-08-12 07:17:52.808085,2021-11-19 16:52:45.111463,https://docs.rs/blake2b_simd,,https://github.com/oconnor663/blake2_simd,79071
predicates,8697487,An implementation of boolean-valued predicate functions.,2017-06-02 17:07:01.532559,2022-01-11 21:31:33.181915,https://docs.rs/predicates,https://github.com/assert-rs/predicates-rs,https://github.com/assert-rs/predicates-rs,17355
home,8681016,Shared definitions of home directories,2017-07-18 23:38:10.759249,2020-01-07 12:03:29.862836,https://docs.rs/home,,https://github.com/brson/home,24000
handlebars,8673511,Handlebars templating implemented in Rust.,2014-12-27 10:28:20.744395,2022-09-11 13:06:17.850603,https://docs.rs/crate/handlebars/,https://github.com/sunng87/handlebars-rust,https://github.com/sunng87/handlebars-rust,648
curl,8662539,Rust bindings to libcurl for making HTTP requests,2014-12-16 19:54:14.189051,2022-07-22 01:58:58.452957,https://docs.rs/curl,https://github.com/alexcrichton/curl-rust,https://github.com/alexcrichton/curl-rust,574
take_mut,8656446,Take a T from a &mut T temporarily,2016-02-14 10:20:19.437725,2018-03-20 05:12:48.872959,,https://github.com/Sgeo/take_mut,https://github.com/Sgeo/take_mut,4174
atomic-waker,8592574,A synchronization primitive for task wakeup,2020-05-29 09:54:53.29133,2020-07-19 15:46:03.137413,https://docs.rs/atomic-waker,https://github.com/stjepang/atomic-waker,https://github.com/stjepang/atomic-waker,247317
indicatif,8591072,A progress bar and cli reporting library for Rust,2017-04-26 12:41:07.759613,2022-09-14 08:07:11.483874,https://docs.rs/indicatif,,https://github.com/console-rs/indicatif,12083
windows_x86_64_gnu,8582150,Code gen support for the windows crate,2021-10-28 19:27:32.276769,2022-09-22 17:02:17.526612,,,https://github.com/microsoft/windows-rs,473671
dyn-clone,8571182,Clone trait that is object-safe,2019-12-23 06:48:24.186057,2022-08-03 13:44:51.448091,https://docs.rs/dyn-clone,,https://github.com/dtolnay/dyn-clone,191672
windows_i686_msvc,8537390,Code gen support for the windows crate,2021-10-27 15:17:41.977374,2022-09-22 17:02:14.758451,,,https://github.com/microsoft/windows-rs,473109
serde_with,8500527,Custom de/serialization functions for Rust's serde,2017-08-17 21:50:27.31267,2022-09-09 20:44:47.104637,https://docs.rs/serde_with/,,https://github.com/jonasbb/serde_with,27924
windows_i686_gnu,8497859,Code gen support for the windows crate,2021-10-28 19:27:12.591562,2022-09-22 17:02:12.013704,,,https://github.com/microsoft/windows-rs,473669
errno,8488644,Cross-platform interface to the `errno` variable.,2015-03-19 21:26:09.647306,2021-10-27 10:26:45.201229,https://docs.rs/errno,,https://github.com/lambda-fairy/rust-errno,1612
inotify-sys,8461354,inotify bindings for the Rust programming language,2017-05-08 15:39:23.44201,2021-01-16 09:40:08.828345,https://docs.rs/inotify-sys,,https://github.com/hannobraun/inotify-sys,13723
dotenv,8400303,A `dotenv` implementation for Rust,2014-11-20 20:53:09.509225,2019-10-21 16:51:12.672006,,https://github.com/dotenv-rs/dotenv,https://github.com/dotenv-rs/dotenv,149
serde_repr,8378549,Derive Serialize and Deserialize that delegates to the underlying repr of a C-like enum.,2019-01-13 01:32:16.572279,2022-08-03 14:01:39.813189,https://docs.rs/serde_repr,,https://github.com/dtolnay/serde-repr,108260
serde_with_macros,8376152,proc-macro library for serde_with,2019-04-02 19:59:37.28235,2022-09-09 20:41:49.978285,https://docs.rs/serde_with_macros/,,https://github.com/jonasbb/serde_with/,125425
windows_aarch64_msvc,8351332,Code gen support for the windows crate,2021-11-05 19:17:58.112695,2022-09-22 17:02:09.32228,,,https://github.com/microsoft/windows-rs,477460
kv-log-macro,8335248,Log macro for log's kv-unstable backend.,2019-09-01 15:56:50.943347,2020-07-06 09:42:00.776479,https://docs.rs/kv-log-macro,,https://github.com/yoshuawuyts/kv-log-macro,161367
utf8parse,8326916,Table-driven UTF-8 parser,2016-09-18 00:27:10.771511,2020-01-12 14:30:30.03792,https://docs.rs/utf8parse/,,https://github.com/jwilm/vte,6531
quick-xml,8307409,High performance xml reader and writer,2016-02-01 05:38:26.023287,2022-09-10 20:22:41.4239,https://docs.rs/quick-xml,,https://github.com/tafia/quick-xml,4043
pyo3,8289073,Bindings to Python interpreter,2017-07-23 18:28:44.917432,2022-08-28 08:32:13.501108,https://docs.rs/crate/pyo3/,https://github.com/pyo3/pyo3,https://github.com/pyo3/pyo3,24723
traitobject,8251269,Unsafe helpers for working with raw trait objects.,2015-04-02 20:05:28.709587,2017-01-30 11:50:51.20276,,,https://github.com/reem/rust-traitobject.git,1761
windows-sys,8222228,Rust for Windows,2021-10-18 14:47:07.495906,2022-04-27 22:36:51.268966,,,https://github.com/microsoft/windows-rs,466814
synom,8140667,Stripped-down Nom parser used by Syn,2017-02-19 19:51:29.241742,2017-03-01 23:55:10.13274,https://docs.rs/synom/,,https://github.com/dtolnay/syn,8587
mio-extras,8131211,Extra components for use with Mio,2017-12-21 15:15:17.65165,2019-12-07 15:47:43.976339,https://docs.rs/mio-extras,,https://github.com/dimbleby/mio-extras,43839
predicates-core,8127650,An API for boolean-valued predicate functions.,2018-07-30 23:24:52.223852,2022-01-11 21:31:21.914558,https://docs.rs/predicates-core,https://github.com/assert-rs/predicates-rs/tree/master/predicates-core,https://github.com/assert-rs/predicates-rs/tree/master/predicates-core,76727
clap_lex,8125677,"Minimal, flexible command line parser",2022-04-15 19:08:14.98876,2022-09-20 21:28:30.411536,,,https://github.com/clap-rs/clap/tree/master/clap_lex,568652
predicates-tree,8117542,Render boolean-valued predicate functions results as a tree.,2018-07-30 23:25:09.954627,2022-01-11 21:31:39.175158,https://docs.rs/predicates-tree,https://github.com/assert-rs/predicates-rs/tree/master/predicates-tree,https://github.com/assert-rs/predicates-rs/tree/master/predicates-tree,76728
async-lock,8113234,Async synchronization primitives,2019-05-22 20:50:55.568552,2022-02-19 10:32:57.973078,,,https://github.com/smol-rs/async-lock,136163
target-lexicon,8088155,Targeting utilities for compilers and related tools,2018-05-24 19:59:42.278674,2022-05-23 15:51:10.589495,https://docs.rs/target-lexicon/,,https://github.com/bytecodealliance/target-lexicon,66926
actix-rt,8043778,Tokio-based single-threaded async runtime for the Actix ecosystem,2018-12-11 16:27:02.597949,2022-03-09 00:30:06.538037,,https://actix.rs,https://github.com/actix/actix-net.git,101450
slog,7973160,"Structured, extensible, composable logging for Rust",2016-06-12 23:00:53.182275,2020-11-30 06:26:09.367402,https://docs.rs/slog,https://github.com/slog-rs/slog,https://github.com/slog-rs/slog,5364
ed25519,7942987,Edwards Digital Signature Algorithm (EdDSA) over Curve25519 (as specified in RFC 8032) support li...,2016-10-06 21:33:33.887375,2022-05-16 15:22:31.361318,https://docs.rs/ed25519,,https://github.com/RustCrypto/signatures/tree/master/ed25519,6766
libsqlite3-sys,7911783,Native bindings to the libsqlite3 library,2015-02-24 02:54:21.21686,2022-07-22 09:33:29.108951,,,https://github.com/rusqlite/rusqlite,1460
ctrlc,7909230,Easy Ctrl-C handler for Rust projects,2015-07-16 08:49:02.855449,2022-08-14 14:52:59.072431,http://detegr.github.io/doc/ctrlc,https://github.com/Detegr/rust-ctrlc,https://github.com/Detegr/rust-ctrlc.git,2612
aes-soft,7889993,DEPRECATED: replaced by the `aes` crate,2018-03-04 13:10:17.816613,2021-05-03 18:44:22.35633,,,https://github.com/RustCrypto/block-ciphers/tree/master/aes,53792
actix-web,7828251,"Actix Web is a powerful, pragmatic, and extremely fast web framework for Rust",2017-10-23 23:08:29.26026,2022-09-12 09:44:11.73106,,https://actix.rs,https://github.com/actix/actix-web.git,36736
actix-codec,7737206,Codec utilities for working with framed protocols,2018-12-11 16:11:24.789455,2022-02-15 01:47:45.627388,,,https://github.com/actix/actix-net,101444
rand_xoshiro,7710203,"Xoshiro, xoroshiro and splitmix64 random number generators",2019-01-04 12:34:17.08929,2020-12-18 19:46:33.912043,https://docs.rs/rand_xoshiro,https://rust-random.github.io/book,https://github.com/rust-random/rngs,105430
string_cache_codegen,7693409,"A codegen library for string-cache, developed as part of the Servo project.",2016-10-28 15:22:43.684874,2022-03-27 22:11:38.633451,https://docs.rs/string_cache_codegen/,,https://github.com/servo/string-cache,7025
publicsuffix,7606049,Extract root domain and suffix from a domain name,2016-12-28 20:54:23.790979,2022-08-10 16:52:45.411482,https://docs.rs/publicsuffix,,https://github.com/rushmorem/publicsuffix,7825
async-mutex,7602596,Async mutex,2019-06-02 09:30:02.46793,2020-09-22 21:57:49.487731,https://docs.rs/async-mutex,https://github.com/stjepang/async-lock,https://github.com/stjepang/async-lock,138456
ascii,7592197,"ASCII-only equivalents to `char`, `str` and `String`.",2014-11-27 14:19:59.536222,2022-09-18 13:04:12.231348,https://docs.rs/ascii,,https://github.com/tomprogrammer/rust-ascii,416
libssh2-sys,7590911,Native bindings to the libssh2 library,2014-11-11 06:38:58.507796,2021-10-10 14:27:26.045107,https://docs.rs/libssh2-sys,,https://github.com/alexcrichton/ssh2-rs,42
bzip2-sys,7580546,Bindings to libbzip2 for bzip2 compression and decompression exposed as Reader/Writer streams. ,2014-11-13 06:35:17.703582,2021-06-09 20:34:33.04888,https://docs.rs/bzip2-sys,https://github.com/alexcrichton/bzip2-rs,https://github.com/alexcrichton/bzip2-rs,76
thread-id,7571759,Get a unique thread ID,2016-03-13 21:01:16.768851,2021-03-24 19:13:02.771474,https://docs.rs/thread-id,,https://github.com/ruuda/thread-id,4446
actix-utils,7565222,Various utilities used in the Actix ecosystem,2018-12-11 16:41:30.670256,2021-04-17 01:02:33.764836,,,https://github.com/actix/actix-net,101454
actix-http,7519966,HTTP primitives for the Actix ecosystem,2019-03-28 19:50:22.257203,2022-09-11 16:22:47.525841,,https://actix.rs,https://github.com/actix/actix-web.git,124414
rust-ini,7490802,An Ini configuration file parsing library in Rust,2015-01-26 04:01:52.645729,2022-02-21 14:09:35.355211,https://docs.rs/rust-ini/,,https://github.com/zonyitoo/rust-ini,886
base-x,7456349,Encode/decode any base,2016-03-30 20:16:02.348858,2022-06-24 12:54:18.725133,,https://github.com/OrKoN/base-x-rs,https://github.com/OrKoN/base-x-rs,4626
rawpointer,7397632,Extra methods for raw pointers and `NonNull<T>`.  For example `.post_inc()` and `.pre_dec()` (c.f...,2016-12-15 11:20:57.55865,2019-09-12 07:51:36.405018,https://docs.rs/rawpointer/,,https://github.com/bluss/rawpointer/,7587
async-global-executor,7368484,A global executor built on top of async-executor and async-io,2020-08-27 14:56:53.28142,2022-08-29 15:43:31.695829,https://docs.rs/async-global-executor,https://github.com/Keruspe/async-global-executor,https://github.com/Keruspe/async-global-executor,281477
ed25519-dalek,7357721,"Fast and efficient ed25519 EdDSA key generations, signing, and verification in pure Rust.",2016-12-09 01:24:53.342073,2020-09-22 02:01:04.148204,https://docs.rs/ed25519-dalek,https://dalek.rs,https://github.com/dalek-cryptography/ed25519-dalek,7514
scoped_threadpool,7318093,A library for scoped and cached threadpools.,2015-08-22 13:43:25.266977,2018-02-20 21:53:55.075569,http://kimundi.github.io/scoped-threadpool-rs/scoped_threadpool/index.html,,https://github.com/Kimundi/scoped-threadpool-rs,2895
matrixmultiply,7312555,General matrix multiplication for f32 and f64 matrices. Operates on matrices with general layout ...,2016-03-28 21:26:28.910493,2021-11-20 18:52:10.438102,https://docs.rs/matrixmultiply/,,https://github.com/bluss/matrixmultiply/,4595
ghost,7310620,Define your own PhantomData,2018-12-23 21:50:20.028234,2022-08-03 13:48:51.184474,https://docs.rs/ghost,,https://github.com/dtolnay/ghost,103500
indoc-impl,7296851,Indented document literals,2017-09-17 17:45:50.745836,2020-06-16 19:06:53.812933,https://docs.rs/indoc,,https://github.com/dtolnay/indoc,32067
widestring,7263916,"A wide string Rust library for converting to and from wide strings, such as those often used in W...",2016-01-25 09:03:34.077126,2022-07-15 21:33:15.884741,,,https://github.com/starkat99/widestring-rs,3986
actix-service,7255363,Service trait and combinators for representing asynchronous request/response operations.,2018-12-09 18:06:41.389362,2021-12-18 03:31:45.081632,,,https://github.com/actix/actix-net,100962
color_quant,7231389,Color quantization library to reduce n colors to 256 colors.,2015-05-29 12:14:41.495169,2020-10-09 19:17:17.742242,,,https://github.com/image-rs/color_quant.git,2251
pyo3-macros,7187773,Proc macros for PyO3 package,2020-12-20 10:05:29.097307,2022-08-28 08:31:39.423459,,https://github.com/pyo3/pyo3,https://github.com/pyo3/pyo3,324813
pyo3-macros-backend,7180615,Code generation for PyO3 package,2020-12-20 10:04:57.813482,2022-08-28 08:31:22.606415,,https://github.com/pyo3/pyo3,https://github.com/pyo3/pyo3,324812
inventory,7179717,Typed distributed plugin registration,2015-07-22 19:31:19.081684,2022-08-03 13:51:38.167351,https://docs.rs/inventory,,https://github.com/dtolnay/inventory,2655
erased-serde,7125099,Type-erased Serialize and Serializer traits,2016-08-21 19:27:33.182632,2022-08-25 00:05:35.918552,https://docs.rs/erased-serde,,https://github.com/dtolnay/erased-serde,6054
tokio-io-timeout,7113121,Tokio wrappers which apply timeouts to IO operations,2017-06-17 03:30:29.00987,2021-12-31 19:12:23.371189,,,https://github.com/sfackler/tokio-io-timeout,19270
stringprep,7083608,An implementation of the stringprep algorithm,2017-05-21 03:53:10.107537,2017-08-01 05:00:59.3274,https://docs.rs/stringprep/0.1.2/stringprep,,https://github.com/sfackler/rust-stringprep,15425
wasmparser,7014184,A simple event-driven library for parsing WebAssembly binary files. ,2017-06-02 16:58:49.610864,2022-09-21 16:24:17.915799,,https://github.com/bytecodealliance/wasm-tools/tree/main/crates/wasmparser,https://github.com/bytecodealliance/wasm-tools/tree/main/crates/wasmparser,17354
actix-server,7005806,General purpose TCP server built for the Actix ecosystem,2018-12-11 16:44:34.322212,2022-03-09 01:08:55.112453,,https://actix.rs,https://github.com/actix/actix-net.git,101456
hkdf,6994341,HMAC-based Extract-and-Expand Key Derivation Function (HKDF),2015-01-03 00:12:58.334169,2022-02-17 11:02:32.916566,,https://github.com/RustCrypto/KDFs/,https://github.com/RustCrypto/KDFs/,688
jpeg-decoder,6977270,JPEG decoder,2016-02-13 21:57:24.620735,2022-05-08 23:11:22.499846,https://docs.rs/jpeg-decoder,,https://github.com/image-rs/jpeg-decoder,4164
openssl-src,6962546,Source of OpenSSL and logic to build it. ,2017-08-29 04:49:53.890414,2022-07-05 14:09:43.179584,,,https://github.com/alexcrichton/openssl-src-rs,29697
blake3,6960728,the BLAKE3 hash function,2019-09-17 19:59:37.30836,2022-01-25 17:16:36.999487,https://docs.rs/blake3,,https://github.com/BLAKE3-team/BLAKE3,165535
actix-macros,6950081,Macros for Actix system and runtime,2019-12-01 14:11:37.045433,2021-10-19 15:28:40.683156,,,https://github.com/actix/actix-net.git,185725
pathdiff,6945934,Library for diffing paths to obtain relative paths,2017-09-20 00:06:24.61598,2021-09-27 21:37:38.430801,https://docs.rs/pathdiff/,,https://github.com/Manishearth/pathdiff,32355
cookie_store,6923331,Implementation of Cookie storage and retrieval,2019-01-10 23:42:13.561793,2022-08-30 03:31:52.024117,https://docs.rs/cookie_store,,https://github.com/pfernie/cookie_store,107844
bzip2,6896955,Bindings to libbzip2 for bzip2 compression and decompression exposed as Reader/Writer streams. ,2014-11-13 06:35:38.538844,2021-06-09 20:34:49.290826,https://docs.rs/bzip2,https://github.com/alexcrichton/bzip2-rs,https://github.com/alexcrichton/bzip2-rs,78
actix-router,6895817,Resource path matching and router,2019-03-09 22:39:40.250434,2022-09-19 17:52:42.412258,,,https://github.com/actix/actix-web.git,119668
actix-web-codegen,6838718,Routing and runtime macros for Actix Web,2019-03-28 20:13:19.911291,2022-09-11 16:22:56.25649,,https://actix.rs,https://github.com/actix/actix-web.git,124424
blake2,6836413,BLAKE2 hash functions,2016-10-06 21:27:29.446062,2022-02-18 18:49:51.761497,https://docs.rs/blake2,,https://github.com/RustCrypto/hashes,6763
copyless,6819297,Ways to eliminate memcpy calls when using the standard library.,2019-03-16 02:37:01.917727,2020-06-01 14:42:47.010209,,https://github.com/kvark/copyless,https://github.com/kvark/copyless,121170
value-bag,6796441,Anonymous structured values,2020-08-18 03:58:58.918633,2022-03-22 11:33:44.514176,https://docs.rs/value-bag,,https://github.com/sval-rs/value-bag,277761
normalize-line-endings,6728327,"Takes an iterator over chars and returns a new iterator with all line endings (\r, \n, or \r\n) a...",2016-05-14 19:00:20.135508,2018-12-16 15:17:15.641063,https://derekdreery.github.io/normalize-line-endings/normalize_line_endings/index.html,,https://github.com/derekdreery/normalize-line-endings,5067
buf_redux,6685396,Drop-in replacements for buffered I/O in `std::io` with extra features.,2016-02-07 11:08:01.02012,2019-07-31 18:22:11.723122,https://docs.rs/buf_redux,,https://github.com/abonander/buf_redux,4116
hyper-timeout,6647682,"A connect, read and write timeout aware connector to be used with hyper Client.",2017-07-15 01:32:03.27574,2021-01-02 17:45:30.889222,https://github.com/hjr3/hyper-timeout,https://github.com/hjr3/hyper-timeout,https://github.com/hjr3/hyper-timeout,23408
rusoto_credential,6623508,AWS credential tooling,2016-11-23 03:32:47.325742,2022-04-25 03:45:41.872028,https://docs.rs/rusoto_credential,,https://github.com/rusoto/rusoto,7338
hashlink,6620332,HashMap-like containers that hold their key-value pairs in a user controllable order,2019-07-06 10:17:21.361009,2022-09-17 17:38:44.631497,https://docs.rs/hashlink,,https://github.com/kyren/hashlink,147087
rusoto_core,6579982,AWS SDK for Rust - Core,2017-05-20 00:54:37.33041,2022-04-25 03:48:30.452153,https://docs.rs/rusoto_core,https://www.rusoto.org/,https://github.com/rusoto/rusoto,15228
multipart,6559593,A backend-agnostic extension for HTTP libraries that provides support for POST multipart/form-dat...,2014-11-28 23:36:47.685449,2021-05-29 03:47:28.226106,http://docs.rs/multipart/,,http://github.com/abonander/multipart,424
input_buffer,6514370,A peekable FIFO-like buffer for receiving network data efficiently,2017-12-11 23:58:21.421292,2021-07-02 14:33:04.932829,https://docs.rs/input_buffer/0.3.1,https://github.com/snapview/input_buffer,https://github.com/snapview/input_buffer,42446
opentelemetry,6512371,A metrics collection and distributed tracing framework,2019-11-08 20:41:11.251122,2022-09-13 02:33:58.401444,,https://github.com/open-telemetry/opentelemetry-rust,https://github.com/open-telemetry/opentelemetry-rust,179476
urlencoding,6493380,A Rust library for doing URL percentage encoding.,2016-09-15 10:44:56.997351,2022-09-02 13:18:56.814146,,https://lib.rs/urlencoding,https://github.com/kornelski/rust_urlencoding,6499
serde_test,6481187,Token De/Serializer for testing De/Serialize implementations,2016-06-29 08:15:45.928821,2022-09-22 17:50:22.873787,https://docs.serde.rs/serde_test/,https://serde.rs,https://github.com/serde-rs/serde,5528
tokio-buf,6459884,Asynchronous stream of byte buffers ,2018-08-20 20:35:52.634656,2019-08-08 19:55:31.214753,https://docs.rs/tokio-buf/0.2.0-alpha.1/tokio_buf,https://tokio.rs,https://github.com/tokio-rs/tokio,80472
const-random-macro,6427467,Provides the procedural macro used by const-random,2019-03-03 00:35:20.62129,2020-12-05 04:03:37.912761,https://docs.rs/const-random,,https://github.com/tkaitchuck/constrandom,118250
const-random,6422167,Provides compile time random number generation.,2019-03-03 00:37:42.180069,2020-12-05 04:04:05.246614,https://docs.rs/const-random,,https://github.com/tkaitchuck/constrandom,118252
output_vt100,6417707,Utility to activate escape codes in Windows' CMD and PowerShell,2019-02-14 01:05:34.50803,2022-02-12 22:53:53.866316,,,https://github.com/Phundrak/output-vt100-rs,114649
typed-arena,6416340,"The arena, a fast but limited type of allocator",2015-04-10 16:54:43.348496,2020-01-10 21:10:45.720252,https://docs.rs/typed-arena,,https://github.com/SimonSapin/rust-typed-arena,1833
twox-hash,6410794,A Rust implementation of the XXHash and XXH3 algorithms,2015-05-09 03:04:03.255761,2022-05-04 15:00:52.181033,https://docs.rs/twox-hash/,,https://github.com/shepmaster/twox-hash,2059
cargo-platform,6402012,Cargo's representation of a target platform.,2019-09-27 17:38:56.154489,2021-08-05 15:19:23.448324,https://docs.rs/cargo-platform,https://github.com/rust-lang/cargo,https://github.com/rust-lang/cargo,168185
termios,6392747,Safe bindings for the termios library.,2015-02-01 21:38:32.491142,2020-10-13 02:04:58.394222,http://dcuddeback.github.io/termios-rs/termios/,https://github.com/dcuddeback/termios-rs,https://github.com/dcuddeback/termios-rs,1333
proptest,6379920,Hypothesis-like property-based testing and shrinking. ,2017-06-18 17:47:46.015744,2021-02-21 03:05:52.898927,https://altsysrq.github.io/rustdoc/proptest/1.0.0/proptest/,https://altsysrq.github.io/proptest-book/proptest/index.html,https://github.com/altsysrq/proptest,19436
stdweb,6359589,A standard library for the client-side Web,2017-03-12 20:09:31.453976,2019-10-10 19:27:40.574687,https://docs.rs/stdweb/*/stdweb/,https://github.com/koute/stdweb,https://github.com/koute/stdweb,8950
serde_derive_internals,6352478,AST representation used by Serde derive macros. Unstable.,2017-04-20 15:12:02.135733,2021-04-09 21:23:45.318899,https://docs.rs/serde_derive_internals,https://serde.rs,https://github.com/serde-rs/serde,11313
ct-logs,6343446,Google's list of Certificate Transparency logs for use with sct crate,2017-07-14 21:30:48.686251,2021-04-10 17:22:10.470887,,https://github.com/ctz/ct-logs,https://github.com/ctz/ct-logs,23392
gif,6321020,GIF de- and encoder,2015-05-29 14:24:47.796231,2022-06-27 06:25:54.657762,https://docs.rs/gif,https://github.com/image-rs/image-gif,https://github.com/image-rs/image-gif,2255
inventory-impl,6276789,Implementation of macros for the `inventory` crate,2018-12-24 16:43:01.497001,2021-11-10 01:05:51.736086,https://docs.rs/inventory,,https://github.com/dtolnay/inventory,103640
shell-escape,6248186,Escape characters that may have a special meaning in a shell,2016-12-30 18:15:23.172777,2020-06-19 23:43:54.63619,,,https://github.com/sfackler/shell-escape,7859
warp,6218726,serve the web at warp speeds,2018-03-29 17:38:58.215096,2021-11-09 18:07:55.391758,https://docs.rs/warp,,https://github.com/seanmonstar/warp,58098
rust-argon2,6195685,Rust implementation of the Argon2 password hashing function.,2017-03-02 19:20:48.506261,2022-01-07 11:11:44.34549,https://docs.sru-systems.com/rust-argon2/1.0.0/argon2/,https://github.com/sru-systems/rust-argon2,https://github.com/sru-systems/rust-argon2,8779
bytestring,6181149,An immutable UTF-8 encoded string using Bytes as storage,2019-12-07 05:03:17.279001,2022-06-11 12:42:03.828177,,https://actix.rs,https://github.com/actix/actix-net.git,187036
der,6153185,Pure Rust embedded-friendly implementation of the Distinguished Encoding Rules (DER) for Abstract...,2020-12-17 19:20:36.976898,2022-05-08 17:06:18.055477,,,https://github.com/RustCrypto/formats/tree/master/der,324007
camino,6121734,UTF-8 paths,2021-02-23 18:20:23.469325,2022-08-12 18:54:21.925759,https://docs.rs/camino,,https://github.com/camino-rs/camino,359582
pretty_env_logger,6066017,a visually pretty env_logger,2016-12-29 21:40:51.235536,2020-01-29 19:55:29.930435,,,https://github.com/seanmonstar/pretty-env-logger,7848
mach,6060852,A Rust interface to the user-space API of the Mach 3.0 kernel that underlies OSX.,2015-02-01 02:40:31.538953,2019-06-01 11:04:57.829203,,,https://github.com/fitzgen/mach,1324
term_size,6032985,functions for determining terminal sizes and dimensions,2016-06-30 02:37:02.66577,2020-05-03 02:34:43.778544,https://docs.rs/term_size/,,https://github.com/kbknapp/term_size-rs.git,5535
rusoto_signature,5987702,AWS SDK for Rust - Request Signing,2019-11-20 04:10:26.775826,2022-04-25 03:47:53.557045,https://docs.rs/rusoto_signature,https://www.rusoto.org/,https://github.com/rusoto/rusoto,182645
const-oid,5964644,Const-friendly implementation of the ISO/IEC Object Identifier (OID) standard as defined in ITU X...,2020-08-04 15:51:24.822805,2022-03-12 00:10:46.51821,https://docs.rs/const-oid,,https://github.com/RustCrypto/formats/tree/master/const-oid,272933
bytecount,5964448,"count occurrences of a given byte, or the number of UTF-8 code points, in a byte slice, fast",2016-09-27 06:50:45.919353,2022-06-01 19:43:56.850547,,,https://github.com/llogiq/bytecount,6638
