name,downloads,description,created_at,updated_at,documentation,homepage,repository,id
libnghttp2-sys,4362743,FFI bindings for libnghttp2 (nghttp2) ,2018-09-12 19:57:19.785896,2021-09-20 14:33:59.280952,,https://github.com/alexcrichton/nghttp2-rs,https://github.com/alexcrichton/nghttp2-rs,84434
protobuf-codegen,4359629,Code generator for rust-protobuf.  Includes a library to invoke programmatically (e. g. from `bui...,2018-05-11 00:51:51.563231,2022-06-22 03:55:33.073635,,https://github.com/stepancheg/rust-protobuf/,https://github.com/stepancheg/rust-protobuf/,64781
mio-named-pipes,4357737,Windows named pipe bindings for mio,2016-12-18 19:10:22.843104,2020-06-30 14:39:34.813841,https://docs.rs/mio-named-pipes/,https://github.com/bbqsrc/mio-named-pipes,https://github.com/bbqsrc/mio-named-pipes,7663
owo-colors,4338857,Zero-allocation terminal colors that'll make people go owo,2020-08-25 06:21:49.001141,2022-08-22 21:14:42.934302,https://docs.rs/owo-colors,,https://github.com/jam1garner/owo-colors,280389
backoff,4321686,Retry operations with exponential backoff policy. ,2017-05-28 08:49:16.062452,2021-12-14 21:16:45.606935,https://docs.rs/backoff,https://github.com/ihrwein/backoff,https://github.com/ihrwein/backoff,16581
jemalloc-sys,4317659,Rust FFI bindings to jemalloc ,2016-01-21 01:18:31.589351,2022-06-24 18:22:57.449719,https://docs.rs/jemallocator-sys,https://github.com/tikv/jemallocator,https://github.com/tikv/jemallocator,3938
syn-mid,4313213,"Providing the features between ""full"" and ""derive"" of syn. ",2019-02-14 15:29:19.458186,2021-01-05 15:18:24.654297,https://docs.rs/syn-mid,,https://github.com/taiki-e/syn-mid,114752
seahash,4301079,"A blazingly fast, portable hash function with proven statistical guarantees.",2016-11-07 22:49:51.868295,2021-01-16 05:41:31.670788,https://docs.rs/seahash,,https://gitlab.redox-os.org/redox-os/seahash,7163
thrift,4297649,Rust bindings for the Apache Thrift RPC system,2017-04-10 20:06:33.76739,2022-07-01 17:45:56.684809,https://docs.rs/thrift,http://thrift.apache.org,https://github.com/apache/thrift/tree/master/lib/rs,10230
rustc-hex,4288792,rustc-serialize compatible hex conversion traits ,2017-05-19 13:06:00.288878,2020-01-10 14:09:36.503165,,https://github.com/debris/rustc-hex,https://github.com/debris/rustc-hex,15157
fixed-hash,4286684,Macros to define custom fixed-size hash types,2017-12-29 16:22:13.066199,2022-09-20 13:04:35.479805,https://docs.rs/fixed-hash/,https://github.com/paritytech/parity-common,https://github.com/paritytech/parity-common,44829
tower-http,4284564,Tower middleware and utilities for HTTP clients and servers,2017-03-10 04:36:50.296787,2022-06-06 18:28:56.16049,,https://github.com/tower-rs/tower-http,https://github.com/tower-rs/tower-http,8912
diesel,4281470,"A safe, extensible ORM and Query Builder for PostgreSQL, SQLite, and MySQL",2015-11-29 17:53:47.748928,2022-08-29 14:23:30.565115,https://docs.rs/diesel/,https://diesel.rs,https://github.com/diesel-rs/diesel,3531
chacha20,4277952,The ChaCha20 stream cipher (RFC 8439) implemented in pure Rust using traits from the RustCrypto `...,2016-10-06 21:11:22.073136,2022-07-07 21:41:53.134583,,,https://github.com/RustCrypto/stream-ciphers,6755
prettytable-rs,4260926,A library for printing pretty formatted tables in terminal,2015-06-17 21:43:24.553194,2022-08-15 15:12:25.562997,https://docs.rs/crate/prettytable-rs/,https://github.com/phsym/prettytable-rs,https://github.com/phsym/prettytable-rs,2413
serde_qs,4260392,Querystrings for Serde,2017-03-12 19:35:23.156845,2022-07-13 16:34:26.837378,https://docs.rs/serde_qs,,https://github.com/samscott89/serde_qs,8949
libsecp256k1,4245158,Pure Rust secp256k1 implementation.,2017-11-10 18:33:33.897453,2022-07-14 16:24:51.862891,,,https://github.com/paritytech/libsecp256k1,38879
bigdecimal,4238320,Arbitrary precision decimal numbers,2017-04-05 23:48:11.922233,2021-08-26 20:38:28.875567,https://docs.rs/bigdecimal,https://github.com/akubera/bigdecimal-rs,https://github.com/akubera/bigdecimal-rs,9751
region,4220130,Cross-platform virtual memory API,2016-11-06 15:09:42.831638,2021-08-05 13:45:30.164889,https://docs.rs/region,https://github.com/darfink/region-rs,https://github.com/darfink/region-rs,7147
primitive-types,4215487,Primitive types shared by Ethereum and Substrate,2018-12-02 14:06:43.175988,2022-09-20 13:05:18.41572,,https://github.com/paritytech/parity-common,,99663
gloo-timers,4213829,Convenience crate for working with JavaScript timers,2019-09-13 11:49:44.838113,2022-04-13 17:55:12.352894,,https://github.com/rustwasm/gloo,https://github.com/rustwasm/gloo/tree/master/crates/timers,164548
snafu-derive,4206766,An ergonomic error handling library,2019-01-28 03:09:42.780108,2022-05-03 01:29:03.305458,https://docs.rs/snafu,,https://github.com/shepmaster/snafu,111033
snafu,4205970,An ergonomic error handling library,2019-01-28 03:09:59.593302,2022-05-03 01:29:47.522863,https://docs.rs/snafu,,https://github.com/shepmaster/snafu,111034
pyo3-build-config,4205224,Build configuration for the PyO3 ecosystem,2021-05-25 06:25:05.705827,2022-08-28 08:31:07.562072,,https://github.com/pyo3/pyo3,https://github.com/pyo3/pyo3,401748
dialoguer,4192461,A command line prompting library.,2017-05-11 06:30:49.422438,2022-07-28 23:05:54.521274,https://docs.rs/dialoguer,https://github.com/mitsuhiko/dialoguer,https://github.com/mitsuhiko/dialoguer,14144
raw-window-handle,4177244,Interoperability library for Rust Windowing applications.,2019-07-25 17:59:29.039274,2022-07-15 14:09:00.282458,https://docs.rs/raw-window-handle,,https://github.com/rust-windowing/raw-window-handle,151612
crc-catalog,4162894,Catalog of CRC algorithms (generated from http://reveng.sourceforge.net/crc-catalogue) expressed ...,2019-12-14 08:16:01.779921,2022-04-23 02:25:43.836575,,,https://github.com/akhilles/crc-catalog.git,189322
simplelog,4155709,A simple and easy-to-use logging facility for Rust's log crate,2016-03-31 12:15:16.057689,2022-04-19 11:43:24.623119,https://docs.rs/simplelog/,,https://github.com/drakulix/simplelog.rs,4640
vergen,4143193,Generate 'cargo:rustc-env' instructions via 'build.rs' for use in your code via the env! macro,2015-02-12 19:09:15.976676,2022-08-31 03:01:02.587712,https://docs.rs/vergen,https://github.com/rustyhorde/vergen,https://github.com/rustyhorde/vergen,1391
redis,4142622,Redis driver for Rust.,2014-11-21 15:32:46.563387,2022-08-24 09:28:20.827263,https://docs.rs/redis,https://github.com/mitsuhiko/redis-rs,https://github.com/mitsuhiko/redis-rs,309
actix-connect,4133810,TCP connector service for Actix ecosystem.,2019-03-15 05:54:02.860632,2020-09-02 23:52:21.589872,https://docs.rs/actix-connect/,https://actix.rs,https://github.com/actix/actix-net.git,120892
poly1305,4129721,The Poly1305 universal hash function and message authentication code,2016-10-06 21:34:24.248885,2022-07-31 18:21:15.565372,https://docs.rs/poly1305,,https://github.com/RustCrypto/universal-hashes,6767
rmp-serde,4115421,Serde bindings for RMP,2015-08-24 12:49:26.519905,2022-04-19 03:45:37.473424,https://docs.rs/rmp-serde,,https://github.com/3Hren/msgpack-rust,2910
diesel_derives,4110759,"You should not use this crate directly, it is internal to Diesel.",2017-11-28 23:51:58.123857,2022-08-29 14:22:28.483846,https://diesel.rs/guides/,https://diesel.rs,https://github.com/diesel-rs/diesel/tree/master/diesel_derives,40914
enumflags2,4089984,Enum-based bit flags,2019-01-29 21:27:53.37125,2022-04-10 14:33:54.228931,https://docs.rs/enumflags2,,https://github.com/NieDzejkob/enumflags2,111478
wast,4073661,Customizable Rust parsers for the WebAssembly Text formats WAT and WAST ,2019-10-16 22:15:44.714072,2022-09-21 16:24:39.825727,https://docs.rs/wast,https://github.com/bytecodealliance/wasm-tools/tree/main/crates/wast,https://github.com/bytecodealliance/wasm-tools/tree/main/crates/wast,173161
enumflags2_derive,4065724,"Do not use directly, use the reexport in the `enumflags2` crate. This allows for better compatibi...",2019-01-29 21:27:19.198123,2022-03-24 02:03:43.104183,,,https://github.com/NieDzejkob/enumflags2,111477
cranelift-frontend,4057241,Cranelift IR builder helper,2018-07-13 16:29:07.20205,2022-09-20 15:56:56.461635,https://docs.rs/cranelift-frontend,,https://github.com/bytecodealliance/wasmtime,74045
os_info,4050571,Detect the operating system type and version.,2017-10-03 15:04:23.233153,2022-09-19 17:05:38.640403,https://docs.rs/os_info,https://github.com/stanislav-tkach/os_info,https://github.com/stanislav-tkach/os_info,34293
termtree,4019634,Visualize tree-like data on the command-line,2021-10-07 18:21:36.306218,2022-04-07 18:58:55.500256,https://docs.rs/termtree,https://github.com/rust-cli/termtree,https://github.com/rust-cli/termtree,461899
parity-scale-codec,4012636,SCALE - Simple Concatenating Aggregated Little Endians,2019-07-17 16:50:03.458892,2022-09-14 15:09:48.34747,,,https://github.com/paritytech/parity-scale-codec,149695
unic-common,4011410,UNIC — Common Utilities,2018-02-07 05:00:15.24703,2019-03-03 04:57:59.630433,,,https://github.com/open-i18n/rust-unic/,49954
unic-char-property,4011017,"UNIC — Unicode Character Tools — Character Property taxonomy, contracts and build macros",2017-09-22 19:37:38.446901,2019-03-03 04:58:16.449988,,,https://github.com/open-i18n/rust-unic/,32679
unic-char-range,4010309,UNIC — Unicode Character Tools — Character Range and Iteration,2017-09-22 19:36:12.454314,2019-03-03 04:58:08.510025,,,https://github.com/open-i18n/rust-unic/,32675
unic-ucd-version,4007678,UNIC — Unicode Character Database — Version,2018-02-07 05:01:15.13116,2019-03-03 04:58:25.487899,,,https://github.com/open-i18n/rust-unic/,49960
unsafe-any,3995626,Traits and implementations for unchecked downcasting.,2014-11-11 06:04:26.456518,2017-05-25 22:07:17.910924,,,https://github.com/reem/rust-unsafe-any,15
ipconfig,3987210,Get network adapters information and network configuration for windows.,2017-09-09 23:23:21.539697,2021-11-23 16:42:13.685215,https://docs.rs/ipconfig/0.3/x86_64-pc-windows-msvc/ipconfig/,https://github.com/liranringel/ipconfig,https://github.com/liranringel/ipconfig,31244
ndarray,3987062,An n-dimensional array for general elements and for numerics. Lightweight array views and slicing...,2015-12-20 22:11:24.106344,2022-07-30 21:04:22.814263,https://docs.rs/ndarray/,,https://github.com/rust-ndarray/ndarray,3717
weezl,3984149,Fast LZW compression and decompression.,2020-06-29 10:53:19.555239,2022-07-10 14:56:54.882479,https://docs.rs/weezl,,https://github.com/image-rs/lzw.git,259345
gethostname,3983455,gethostname for all platforms,2019-01-20 18:20:36.505189,2022-03-12 12:11:05.97044,https://docs.rs/gethostname,https://codeberg.org/flausch/gethostname.rs,https://codeberg.org/flausch/gethostname.rs.git,109700
wincolor,3980329,DEPRECATED. Use winapi-util instead.,2016-11-20 20:44:40.055503,2020-01-11 15:07:48.314839,https://docs.rs/wincolor,https://github.com/BurntSushi/termcolor/tree/master/wincolor,https://github.com/BurntSushi/termcolor/tree/master/wincolor,7316
der-parser,3977366,Parser/encoder for ASN.1 BER/DER data,2017-03-02 08:38:50.588643,2022-05-24 16:00:48.613122,,https://github.com/rusticata/der-parser,https://github.com/rusticata/der-parser.git,8762
psm,3974701,Portable Stack Manipulation: stack manipulation and introspection routines,2018-12-29 17:52:03.479403,2022-09-24 14:24:09.286441,https://docs.rs/psm/0.1.20,,https://github.com/rust-lang/stacker/,104434
compiler_builtins,3974647,Compiler intrinsics used by the Rust compiler. Also available for other targets if necessary! ,2018-11-21 19:13:56.864043,2022-09-20 08:21:22.038482,https://docs.rs/compiler_builtins,https://github.com/rust-lang/compiler-builtins,https://github.com/rust-lang/compiler-builtins,98016
elliptic-curve,3972102,"General purpose Elliptic Curve Cryptography (ECC) support, including types and traits for represe...",2019-12-05 17:07:27.394753,2022-08-02 03:20:08.67619,,,https://github.com/RustCrypto/traits/tree/master/elliptic-curve,186697
jemallocator,3966794,A Rust allocator backed by jemalloc ,2016-01-21 01:19:18.642439,2022-05-24 23:59:35.268721,https://docs.rs/jemallocator,https://github.com/tikv/jemallocator,https://github.com/tikv/jemallocator,3939
treeline,3958604,a library for visualizing tree structured data,2017-08-03 02:56:40.231102,2017-08-03 02:56:40.231102,https://softprops.github.io/treeline,https://github.com/softprops/treeline,https://github.com/softprops/treeline,26189
typemap,3954261,A typesafe store for many value types.,2014-11-11 06:07:42.392263,2015-12-16 00:01:49.263868,,,https://github.com/reem/rust-typemap,16
deunicode,3943149,Convert Unicode strings to pure ASCII by intelligently transliterating them. Suppors Emoji and Ch...,2018-05-05 19:10:46.167858,2022-08-21 15:41:25.234151,https://docs.rs/deunicode,https://lib.rs/crates/deunicode,https://github.com/kornelski/deunicode/,63908
ipnetwork,3942504,A library to work with IP CIDRs in Rust,2015-04-24 07:20:40.441668,2022-07-01 03:01:31.656014,,,https://github.com/achanda/ipnetwork,1930
atomic,3934210,Generic Atomic<T> wrapper type,2016-03-30 15:37:44.649798,2021-11-10 19:00:17.212527,https://amanieu.github.io/atomic-rs/atomic/index.html,,https://github.com/Amanieu/atomic-rs,4619
pico-args,3928868,An ultra simple CLI arguments parser.,2019-07-21 18:38:09.093586,2022-06-04 12:11:35.198777,https://docs.rs/pico-args/,,https://github.com/RazrFalcon/pico-args,150599
trybuild,3920744,Test harness for ui tests of compiler diagnostics,2019-05-06 16:29:47.498008,2022-09-22 23:04:46.463507,https://docs.rs/trybuild,,https://github.com/dtolnay/trybuild,132412
ieee754,3919983,Low-level manipulations of IEEE754 floating-point numbers. ,2015-05-11 11:42:04.340766,2020-12-20 00:38:43.810143,http://docs.rs/ieee754,https://github.com/huonw/ieee754,https://github.com/huonw/ieee754,2078
scroll,3916275,"A suite of powerful, extensible, generic, endian-aware Read/Write traits for byte buffers",2016-11-23 06:10:48.255694,2022-01-02 22:35:02.742498,https://docs.rs/scroll,,https://github.com/m4b/scroll,7339
rgb,3913687,`struct RGB/RGBA/etc.` for sharing pixels between crates + convenience methods for color manipula...,2016-06-18 17:02:02.336922,2022-09-18 23:45:56.501336,https://docs.rs/rgb,https://lib.rs/crates/rgb,https://github.com/kornelski/rust-rgb,5416
jni-sys,3903220,Rust definitions corresponding to jni.h,2016-02-26 06:37:49.528984,2017-07-21 03:03:42.609998,https://docs.rs/jni-sys/0.3.0/jni_sys,,https://github.com/sfackler/rust-jni-sys,4295
uname,3881440,Name and information about current kernel,2016-10-10 22:26:11.574702,2016-10-11 18:23:38.774567,https://icorderi.github.io/rust-uname/index.html,https://github.com/icorderi/rust-uname,https://github.com/icorderi/rust-uname,6809
tera,3862976,Template engine based on Jinja2/Django templates,2016-04-04 16:03:33.335054,2022-09-19 11:18:07.286035,,https://tera.netlify.com/,https://github.com/Keats/tera,4672
hmac-drbg,3848052,Pure Rust implementation of Hmac DRBG.,2017-11-07 12:10:07.955741,2020-06-15 02:27:43.953301,,,,38457
raw-cpuid,3846853,"A library to parse the x86 CPUID instruction, written in rust with no external dependencies. The ...",2015-03-24 19:38:22.01072,2022-09-12 18:02:25.248423,https://docs.rs/raw-cpuid/,https://github.com/gz/rust-cpuid,https://github.com/gz/rust-cpuid,1713
errno-dragonfly,3837492,Exposes errno functionality to stable Rust on DragonFlyBSD,2017-07-10 18:46:44.46987,2021-09-27 08:59:29.274682,,,https://github.com/mneumann/errno-dragonfly-rs,22896
users,3828394,Library for accessing Unix users and groups,2014-12-12 10:37:35.520404,2020-10-08 02:15:28.604296,https://docs.rs/users/,,https://github.com/ogham/rust-users,535
difflib,3817806,Port of Python's difflib library to Rust.,2016-03-01 20:11:02.811921,2018-07-22 12:47:54.378558,https://github.com/DimaKudosh/difflib/wiki,https://github.com/DimaKudosh/difflib,https://github.com/DimaKudosh/difflib,4340
typed-builder,3810885,Compile-time type-checked builder derive,2017-10-04 23:49:38.955558,2022-02-13 14:54:56.319268,https://idanarye.github.io/rust-typed-builder/,,https://github.com/idanarye/rust-typed-builder,34443
rsa,3798428,Pure Rust RSA implementation,2018-07-24 08:31:14.033066,2022-09-16 17:46:32.113232,https://docs.rs/rsa,,https://github.com/RustCrypto/RSA,75737
winit,3798343,Cross-platform window creation library.,2016-03-26 18:11:31.722652,2022-09-11 17:01:49.03129,https://docs.rs/winit,,https://github.com/rust-windowing/winit,4573
shared_child,3793908,a library for using child processes from multiple threads,2017-02-06 05:15:40.329949,2021-11-16 23:55:28.528703,https://docs.rs/shared_child,,https://github.com/oconnor663/shared_child.rs,8408
sentry-types,3788224,Common reusable types for implementing the sentry.io protocol. ,2018-03-25 22:30:37.109834,2022-06-20 10:56:27.406867,,https://sentry.io/welcome/,https://github.com/getsentry/sentry-rust,57500
gl_generator,3784245,Code generators for creating bindings to the Khronos OpenGL APIs.,2014-11-12 18:21:59.03388,2019-10-03 10:44:28.795911,https://docs.rs/gl_generator,https://github.com/brendanzab/gl-rs/,https://github.com/brendanzab/gl-rs/,68
rusttype,3784153,"A pure Rust alternative to libraries like FreeType.  RustType provides an API for loading, queryi...",2016-02-05 17:24:38.164341,2020-05-23 00:04:46.503712,https://docs.rs/rusttype,https://gitlab.redox-os.org/redox-os/rusttype,https://gitlab.redox-os.org/redox-os/rusttype,4087
cranelift-entity,3776384,Data structures using entity references as mapping keys,2018-07-13 16:27:03.77909,2022-09-20 15:56:49.297118,https://docs.rs/cranelift-entity,,https://github.com/bytecodealliance/wasmtime,74043
sentry,3774844,Sentry (getsentry.com) client for rust ;) ,2016-05-20 17:24:17.084103,2022-06-20 10:57:20.023447,,https://sentry.io/welcome/,https://github.com/getsentry/sentry-rust,5120
nb,3767240,Minimal non-blocking I/O layer,2018-01-10 18:36:16.755519,2020-07-10 07:04:55.298117,https://docs.rs/nb,https://github.com/rust-embedded/nb,https://github.com/rust-embedded/nb,46266
chacha20poly1305,3755448,Pure Rust implementation of the ChaCha20Poly1305 Authenticated Encryption with Additional Data Ci...,2016-10-06 21:17:44.421862,2022-08-10 03:37:43.851637,https://docs.rs/chacha20poly1305,,https://github.com/RustCrypto/AEADs/tree/master/chacha20poly1305,6758
slog-json,3754045,JSON drain for slog-rs,2016-07-11 07:06:42.600533,2022-03-21 18:11:23.119992,https://docs.rs/slog-json,https://github.com/slog-rs/slog,https://github.com/slog-rs/json,5628
actix,3750403,Actor framework for Rust,2017-09-25 16:26:55.87198,2022-03-01 04:02:52.451329,https://docs.rs/actix,,https://github.com/actix/actix,33078
schemars,3750232,Generate JSON Schemas from Rust code,2019-08-08 18:03:22.855604,2022-05-17 17:35:18.337366,,https://graham.cool/schemars/,https://github.com/GREsau/schemars,155083
fern,3749044,"Simple, efficient logging",2014-12-19 23:32:30.645409,2022-04-15 15:23:11.589934,https://docs.rs/fern/,,https://github.com/daboross/fern,608
rusticata-macros,3747620,Helper macros for Rusticata,2017-02-20 20:19:04.799102,2022-02-07 10:59:17.467859,,https://github.com/rusticata/rusticata-macros,https://github.com/rusticata/rusticata-macros.git,8606
schemars_derive,3744309,"Macros for #[derive(JsonSchema)], for use with schemars",2019-08-08 17:52:12.568797,2022-05-17 17:34:56.629751,,https://graham.cool/schemars/,https://github.com/GREsau/schemars,155080
cranelift-codegen-meta,3727760,Metaprogram for cranelift-codegen code generator library,2018-08-03 03:32:06.638906,2022-09-20 15:56:52.286828,,,https://github.com/bytecodealliance/wasmtime,77267
cranelift-codegen,3717621,Low-level code generator library,2018-07-13 16:28:34.396845,2022-09-20 15:56:53.385887,https://docs.rs/cranelift-codegen,,https://github.com/bytecodealliance/wasmtime,74044
im,3715227,Immutable collection datatypes,2017-04-17 16:06:00.142286,2022-04-29 14:12:56.603719,http://immutable.rs/,http://immutable.rs/,https://github.com/bodil/im-rs,11005
cranelift-bforest,3710871,A forest of B+-trees,2018-08-14 19:55:48.797407,2022-09-20 15:56:50.888808,https://docs.rs/cranelift-bforest,,https://github.com/bytecodealliance/wasmtime,79459
getset,3709204,"Getset, we're ready to go!  A procedural macro for generating the most basic getters and setters ...",2017-06-02 09:45:04.54476,2021-11-28 01:24:36.664427,,,https://github.com/Hoverbear/getset,17305
jni,3705494,Rust bindings to the JNI,2016-11-08 00:40:20.801845,2021-02-06 16:49:22.556061,https://docs.rs/jni,,https://github.com/jni-rs/jni-rs,7164
rle-decode-fast,3694618,Deprecated: this is available in stable Rust since 1.53 as Vec::extend_from_within().  Previsouly...,2019-06-30 14:01:50.454,2022-01-30 22:56:56.002573,,,https://github.com/WanzenBug/rle-decode-helper,144978
num-bigint-dig,3691429,Big integer implementation for Rust,2018-11-24 11:05:02.696017,2022-03-01 14:07:17.172559,https://docs.rs/num-bigint-dig,https://github.com/dignifiedquire/num-bigint,https://github.com/dignifiedquire/num-bigint,98411
regalloc,3677556,Modular register allocation algorithms,2020-01-30 16:27:08.200152,2022-01-19 23:37:57.684776,,,https://github.com/bytecodealliance/regalloc.rs,203333
slug,3676220,Convert a unicode string to a slug,2015-07-13 16:35:01.819804,2018-09-07 16:51:23.802817,https://docs.rs/slug,https://github.com/Stebalien/slug-rs,https://github.com/Stebalien/slug-rs,2598
cranelift-codegen-shared,3669583,For code shared between cranelift-codegen-meta and cranelift-codegen,2019-09-24 23:28:59.987055,2022-09-20 15:56:51.752338,,,https://github.com/bytecodealliance/wasmtime,167401
ecdsa,3665467,Pure Rust implementation of the Elliptic Curve Digital Signature Algorithm (ECDSA) as specified i...,2018-10-30 23:40:45.698779,2022-09-15 21:55:55.877555,,,https://github.com/RustCrypto/signatures/tree/master/ecdsa,93701
hdrhistogram,3658088,A port of HdrHistogram to Rust,2015-07-07 20:58:59.521601,2022-09-18 16:40:04.126938,https://docs.rs/hdrhistogram,https://github.com/HdrHistogram/HdrHistogram_rust,https://github.com/HdrHistogram/HdrHistogram_rust.git,2555
rustyline,3649249,"Rustyline, a readline implementation based on Antirez's Linenoise",2015-09-05 23:21:20.022538,2022-07-17 09:38:17.528308,http://docs.rs/rustyline,,https://github.com/kkawakam/rustyline,2992
assert-json-diff,3644170,Easily compare two JSON values and get great output,2018-10-17 08:08:13.861112,2022-06-29 21:40:34.607604,https://docs.rs/assert-json-diff,https://github.com/davidpdrsn/assert-json-diff,https://github.com/davidpdrsn/assert-json-diff.git,91116
procfs,3636322,Interface to the linux procfs pseudo-filesystem,2018-06-17 21:50:15.090115,2022-08-21 00:17:04.717493,https://docs.rs/procfs/,,https://github.com/eminence/procfs,70550
inflate,3633383,DEFLATE decoding,2015-11-10 15:29:39.03344,2019-02-13 19:27:47.940278,,,https://github.com/PistonDevelopers/inflate.git,3392
infer,3625760,Small crate to infer file type based on magic number signatures,2019-02-23 00:50:12.520054,2022-07-02 23:12:57.850369,https://docs.rs/infer,https://github.com/bojand/infer,https://github.com/bojand/infer,116653
scroll_derive,3619280,A macros 1.1 derive implementation for Pread and Pwrite traits from the scroll crate,2017-01-31 06:41:58.184965,2022-01-02 22:34:23.528307,https://docs.rs/scroll_derive,,https://github.com/m4b/scroll,8320
derive-new,3613553,`#[derive(new)]` implements simple constructor functions for structs and enums.,2016-10-08 02:15:51.576678,2021-02-08 21:46:26.98121,,,https://github.com/nrc/derive-new,6781
async-recursion,3606001,Recursion for async functions,2019-10-04 00:56:26.118378,2022-01-04 22:55:59.175952,https://docs.rs/async-recursion,,https://github.com/dcchut/async-recursion,169753
metrics,3601970,A lightweight metrics facade.,2015-09-03 22:02:07.047796,2022-07-22 14:51:04.705215,https://docs.rs/metrics,https://github.com/metrics-rs/metrics,https://github.com/metrics-rs/metrics,2984
secrecy,3594022,"Wrapper types and traits for secret management which help ensure they aren't accidentally copied,...",2018-10-04 03:59:35.046194,2021-07-18 19:07:50.475079,,https://github.com/iqlusioninc/crates/,https://github.com/iqlusioninc/crates/tree/main/secrecy,87933
wayland-sys,3590837,FFI bindings to the various libwayland-*.so libraries. You should only need this crate if you are...,2015-10-03 11:08:21.431559,2022-09-16 09:03:46.637598,https://docs.rs/wayland-sys/,,https://github.com/smithay/wayland-rs,3150
secp256k1-sys,3589643,FFI for Pieter Wuille's `libsecp256k1` library.,2019-12-10 20:45:37.791441,2022-06-22 17:02:56.033413,https://docs.rs/secp256k1-sys/,https://github.com/rust-bitcoin/rust-secp256k1/,https://github.com/rust-bitcoin/rust-secp256k1/,188309
antidote,3577948,Poison-free versions of the standard library Mutex and RwLock types,2016-03-11 04:07:43.326001,2016-05-21 19:42:12.837697,https://sfackler.github.io/rust-antidote/doc/v1.0.0/antidote,,https://github.com/sfackler/rust-antidote,4424
assert_cmd,3571054,Test CLI Applications.,2018-05-28 20:57:36.584641,2022-01-13 15:17:24.996869,http://docs.rs/assert_cmd/,https://github.com/assert-rs/assert_cmd,https://github.com/assert-rs/assert_cmd.git,67510
cbindgen,3568539,A tool for generating C bindings to Rust code.,2017-04-12 15:57:46.00735,2022-06-09 20:39:00.456382,,,https://github.com/eqrion/cbindgen/,10418
postgres-protocol,3563775,Low level Postgres protocol APIs,2016-09-22 04:38:58.587437,2022-04-30 12:26:14.104424,,,https://github.com/sfackler/rust-postgres,6582
duct,3560396,a library for running child processes,2016-02-20 18:55:39.791588,2021-02-04 20:55:41.602234,https://docs.rs/duct,,https://github.com/oconnor663/duct.rs,4228
priority-queue,3559854,A Priority Queue implemented as a heap with a function to efficiently change the priority of an i...,2017-07-06 09:25:22.974664,2022-07-23 08:38:22.689898,https://docs.rs/priority-queue,,https://github.com/garro95/priority-queue,22156
